pubmedID,title,keywords,authors,abstracts,label1,label2
12028164,"Efficacy, safety, and tolerability of extended-release once-daily tolterodine treatment for overactive bladder in older versus younger patients.","Adult; Age Factors; Aged; Aged, 80 and over; Benzhydryl Compounds; Cohort Studies; Cresols; Delayed-Action Preparations; Double-Blind Method; Female; Humans; Male; Middle Aged; Muscarinic Antagonists; Phenylpropanolamine; Tolterodine Tartrate; Urinary Bladder Diseases; Urinary Incontinence; Xerostomia","Zinner, Norman R; Mattiasson, Anders; Stanton, Stuart L","To evaluate the efficacy, safety, and tolerability of a new, once-daily extended-release (ER) formulation of tolterodine in treating overactive bladder in older (> or =65) and younger (<65) patients.; A 12-week double-blind, placebo-controlled clinical trial.; An international study conducted at 167 medical centers.; One thousand fifteen patients (43.1% aged > or =65) with urge incontinence and urinary frequency.; Patients were randomized to treatment with tolterodine ER 4 mg once daily (qd) (n = 507) or placebo (n = 508) for 12 weeks.; Efficacy, measured with micturition charts (incontinence episodes, micturitions, volume voided per micturition) and subjective patient assessments, safety, and tolerability endpoints were evaluated, relative to placebo, according to two age cohorts: younger than 65 and 65 and older.; Mean age in the older and younger patient cohorts was 74 (range 65-93) and 51 (range 20-64), respectively. Compared with placebo, significant improvements in micturition chart variables with tolterodine ER showed no age-related differences. Irrespective of age, significantly more tolterodine ER recipients than placebo recipients reported an improvement in urgency symptoms. After 12 weeks of treatment with tolterodine ER, a fivefold increase in the percentage of patients able to finish tasks before voiding in response to urgency was noted in both age groups (<65: from 6.5-32.8%, > or =65: from 5.1-26.2%). Tolterodine ER recipients, irrespective of age, also had significant improvements in their bladder condition than did placebo recipients. Overall, a greater percentage of patients, irrespective of age, perceived any benefit with tolterodine ER than with placebo (P <.001). Dry mouth (of any severity) was the most common adverse event in both the tolterodine ER and placebo treatment arms, irrespective of age (<65: ER 22.7%, placebo 8.1%; > or =65: ER 24.3%, placebo 7.2%). Few patients (<2%) experienced severe dry mouth. No central nervous system, visual, cardiac (per electrocardiogram), or laboratory safety concerns were noted. Withdrawal rates due to adverse events on tolterodine ER 4 mg qd were comparable in the two age cohorts (<65: 5.5%; > or =65: 5.1%; P =.87).; The new, once-daily ER formulation of tolterodine is efficacious, safe, and well tolerated in the treatment of patients with symptoms of overactive bladder, irrespective of age.",I,I
12028165,Urodynamic changes associated with behavioral and drug treatment of urge incontinence in older women.,"Age Factors; Aged; Aged, 80 and over; Behavior Therapy; Double-Blind Method; Female; Humans; Mandelic Acids; Middle Aged; Parasympatholytics; Severity of Illness Index; Sex Factors; Urinary Bladder; Urinary Incontinence; Urodynamics","Goode, Patricia S; Burgio, Kathryn L; Locher, Julie L; Umlauf, Mary G; Lloyd, L Keith; Roth, David L","To describe changes in bladder function and voiding frequency associated with behavioral and drug treatment for urge incontinence and to examine whether these variables mediate the positive effects of treatment on the frequency of incontinence.; Randomized, double-blinded, placebo-controlled, clinical trial. Eligible patients were stratified according to type of incontinence (urge only vs mixed urge and stress) and severity of incontinence (frequency of accidents as documented in bladder diary).; University-based outpatient geriatric medicine clinic.; One hundred five ambulatory, nondemented, community-dwelling women; mean age 67.0 (range 55-91); 98% white, 2% African American.; Four sessions (over 8 weeks) of biofeedback-assisted behavioral training, drug treatment with individually-titrated oxybutynin chloride, or a placebo control condition.; Two-channel cystometry was performed to determine threshold volumes for first desire to void (FDV), strong desire to void (SDV), bladder capacity, and the volume at which detrusor instability (DI) or leakage occurred, before randomization and after completion of treatment. Two-week bladder diaries were used before and after treatment to document episodes of incontinence and voiding frequency.; Bladder capacity increased by 68.9 mL in the oxybutynin group (P <.001) and 17.3 mL in the behavior group and decreased 6.0 mL in the control group. SDV increased 69.9 mL in the oxybutynin group (P <.001), 40.5 in the behavior group (P <.05), and 7.8 mL in the control group. FDV increased by 44.4 mL in the oxybutynin group (P <.001), 18.8 mL in the behavior group, and 8.9 mL in the control group. One of seven patients who presented with DI (12.0%) resolved in the behavior group, seven of eight (87.5%) resolved in the oxybutynin group, and seven of 12 (58.3%) resolved in the control group. These differences were not statistically significant. Voiding frequency was significantly reduced after treatment in both the behavior and the oxybutynin group. Behavioral training resulted in a mean 82.3% reduction in frequency of accidents, oxybutynin (final doses 2.5 mg daily to 5 mg three times a day) resulted in a mean 78.3% reduction, and the control condition resulted in a mean 51.5% reduction (P =.002). Although oxybutynin and behavioral treatment were both effective, and oxybutynin increased SDV and bladder capacity, the structural equation modeling did not demonstrate that the clinical improvement was mediated through the effects of these treatments on urodynamic or voiding frequency measures.; Studies using more-complex urodynamics and studies with larger sample sizes are needed to better characterize changes in bladder function and explore other urodynamic changes that may accompany treatment. In addition, other factors, both physiological and behavioral, need to be explored as mechanisms by which conservative therapies improve urge incontinence.",I,I
12028169,Use of anticholinergic medications by older adults with dementia.,"Age Factors; Aged; Aged, 80 and over; Case-Control Studies; Cholinergic Antagonists; Cholinesterase Inhibitors; Contraindications; Dementia; Female; Humans; Indans; Male; Piperidines; Retrospective Studies","Roe, Catherine M; Anderson, Michael J; Spivack, Barney","To compare the prevalence of anticholinergic use in older adults with probable dementia with that of a matched comparison group of older adults who were unlikely to have dementia and to examine the extent to which patients taking donepezil concomitantly use anticholinergic medications.; Retrospective study.; Community-based older adults receiving medications through a pharmacy benefit management company.; Eight hundred thirty-six patients aged 65 and older. Patients taking donepezil (n = 418) constituted the treatment group. Patients not taking donepezil (n = 418) constituted the comparison group. Each treatment group member was matched with a comparison group member on the basis of age, sex, and number of drugs taken for chronic conditions.; The prevalence of anticholinergic use was compared in the treatment and comparison groups over a 3- to 12-month follow-up period using pharmacy claims data. The proportion of follow-up period days that treatment group members concomitantly used donepezil and anticholinergics was also examined.; Older adults with probable dementia were more likely to use anticholinergics than matched comparison group patients (33.0% vs 23.4%; P =.001). Of treatment group members receiving anticholinergics, 26.1% used multiple anticholinergic medications. Treatment group members who received anticholinergics used those drugs concomitantly with donepezil on a mean of 28.4% of follow-up period days.; Community-based, commercially insured, older adults with probable dementia are more likely to take anticholinergics than matched controls. Patients taking donepezil frequently use an anticholinergic medication concomitantly. This study suggests that prescribing for older adults with dementia could be improved, especially if cognitive enhancing agents are being considered.",E,E
12028232,Incorrect assumption regarding the mechanism of action of flavoxate.,Flavoxate; Humans; Mental Disorders; Parasympatholytics; Structure-Activity Relationship,"Pikovskaya, Irina",NA,E,E
12028256,Urinary antispasmodic use and the risks of ventricular arrhythmia and sudden death in older patients.,"Aged; Aged, 80 and over; Arrhythmias, Cardiac; Cholinergic Antagonists; Cohort Studies; Death, Sudden; Female; Humans; Male; Muscarinic Antagonists; Nursing Homes; Parasympatholytics; Retrospective Studies; Risk Factors; Urinary Incontinence","Wang, Philip S; Levin, Raisa; Zhao, Sean Z; Avorn, Jerry","The introduction of new medications to treat overactive bladder has resulted in a significant increase in the number of individuals with this condition who use medications for symptoms. Formal epidemiological studies of the safety of these medications in typical patient populations are lacking, particularly studies of serious events. We sought to determine whether the use of urinary antispasmodics increases the risk of ventricular arrhythmias or sudden death.; Retrospective cohort study.; Retrospective analysis of data of participants in community, hospital or nursing home setting.; Fourteen thousand six hundred thirty-eight subjects with a diagnosis of urinary incontinence made between January 1, 1991, and June 30, 1995; all were aged 65 and older and enrolled in Medicare and Medicaid or the Pharmacy Assistance for the Aged and Disabled programs of New Jersey.; Filled prescriptions for oxybutynin (Ditropan), flavoxate (Urispas), hyoscyamine (Cystospas), and hyoscyamine sulfate (Cystospas-M) were used to define days of exposure to these drugs. We also identified all use of nonsedating antihistamines and cytochrome P450 3A4 inhibitors, and their concurrent use, to serve as a positive control exposure. Two outcomes were then defined: a new diagnosis of ventricular arrhythmia combined with initiation of an antiarrhythmic medication and sudden death. Other covariates, including clinical, demographic, medication use, and healthcare utilization variables, were also assessed. Adjusted risk ratios of ventricular arrhythmia and sudden death were derived from multivariable Cox proportional hazards models.; There was no significant association between periods of use of urinary antispasmodics and the development of ventricular arrhythmias (adjusted risk ratio (RR) = 1.23, 95 confidence interval (CI) = 0.87-1.75) or sudden death (adjusted RR = 0.70, 95% CI = 0.28-1.74). A significantly increased risk of ventricular arrhythmia was observed for the positive control regimen, concurrent use of nonsedating antihistamines and cytochrome P450 3A4 inhibitors (adjusted RR = 5.47; 95% CI = 1.34-22.26), but not for use of either drug group alone. Concurrent use of nonsedating antihistamines and cytochrome P450 3A4 inhibitors was also associated with a significant increase in the risk of sudden death (adjusted RR = 21.50, 95% CI = 5.23-88.37). Other variables significantly associated with ventricular arrhythmia included ischemic heart disease and congestive heart failure, whereas nursing home use before the index date was associated with a decreased likelihood of receiving a diagnosis of and treatment for ventricular arrhythmia. Other variables significantly associated with sudden death included male gender, black race, and congestive heart failure.; Antimuscarinic urinary antispasmodics available before 1996 were not associated with an increased risk of ventricular arrhythmias and sudden death. Additional study will be required to confirm these results, exclude the possibility of unmeasured confounders contributing to any lack of an observed relationship, and extend these findings to newer agents such as tolterodine.",I,I
12030634,Overactive bladder patients and role of the pharmacist.,Cost of Illness; Humans; Patient Education as Topic; Pharmacists; Quality of Life; Urinary Bladder Diseases,"Stewart, Kate; McGhan, William F; Offerdahl, Tracy; Corey, Ron","To summarize the prevalence, quality of life (QOL) implications, cost of illness, and pharmacotherapy of overactive bladder (OAB), and to describe the pharmacist's role in the management of patients with OAB.; Articles published between 1990 and 2001 identified through a MEDLINE search using the terms overactive bladder, unstable bladder, urinary incontinence, prevalence, cost of illness, quality of life, drug therapy, pharmacist, and pharmacy in various combinations.; All studies providing information on OAB or urinary incontinence were retrieved.; By the authors.; Published prevalence and cost studies focus primarily on urinary incontinence, which is only one possible symptom of OAB. Reported prevalence rates of urge and mixed incontinence in the United States range from 3% to 8% and 5% to 37%, respectively, and the highest prevalence has been found in geriatric and psychogeriatric populations. Associated costs are substantial. Total costs of OAB in the United States were estimated to be $12.6 billion in 2000. Patients with OAB score lower than the general population in QOL assessments. All aspects of QOL can be compromised by OAB, as physical, social, occupational, domestic, and sexual activities are often limited in OAB patients. The pharmacist is instrumental in improving an individual's QOL through ensuring safe and effective treatment for OAB. Oxybutynin and tolterodine (Detrol-Pharmacia) have been the mainstays of pharmacotherapy for OAB, but frequent adverse effects (including dry mouth) often prevent patients from adhering to treatment. Tolterodine, now available in a new long-acting formulation, has been proven safe and efficacious in the treatment of OAB, with fewer adverse effects and better tolerability than existing agents.; Pharmacists can play an active role in helping identify and recommending interventions for OAB that can ultimately improve an individual's QOL.",E,E
12045724,Sexual and urological dysfunction in multiple sclerosis: better understanding and improved therapies.,"Copulation; Erectile Dysfunction; Female; Genitalia, Female; Genitalia, Male; Humans; Male; Multiple Sclerosis; Urinary Bladder; Urination Disorders","DasGupta, Ranan; Fowler, Clare J","The fundamental strategy in treating multiple sclerosis patients with unstable bladders involves a combination of suppressing urgency and ensuring effective urinary drainage. Anti-cholinergics remain the first-line treatment, but alternative therapies are undergoing clinical trials. With a range of new pro-erectile oral medications available, interest has grown in treatment of multiple sclerosis-related erectile failure. Female sexual dysfunction is also now gaining some attention, with new classification criteria and methods for assessing and treating these patients.",E,E
12047983,Treatment interventions for Parkinson's disease: an evidence based assessment.,Disease Progression; Evidence-Based Medicine; Humans; Parkinson Disease; Randomized Controlled Trials as Topic,"Rascol, Olivier; Goetz, Christopher; Koller, William; Poewe, Werner; Sampaio, Cristina","We did a systematic review, with a uniform method of assessment of efficacy and safety, to assess the different interventions available for the management of Parkinson's disease (drugs, surgical interventions, and physical treatments) with respect to the following indications: prevention of disease progression, symptomatic treatment of motor features (parkinsonism), symptomatic control of motor complications, prevention of motor complications, and symptomatic treatment of non-motor features. Our aim was not to define practice guidelines, but rather to improve clinicians' knowledge of the presently available published clinical evidence, based mainly on randomised controlled trials. We hope that our review will help doctors to incorporate this background into their own decision-making strategy to make appropriate choices with respect to the treatment of individual patients with Parkinson's disease.",E,E
12060436,Tolterodine: as effective but better tolerated than oxybutynin in Asian patients with symptoms of overactive bladder.,"Adult; Aged; Aged, 80 and over; Asian Continental Ancestry Group; Benzhydryl Compounds; Cholinergic Antagonists; Cresols; Female; Humans; Male; Mandelic Acids; Middle Aged; Muscarinic Antagonists; Phenylpropanolamine; Tolterodine Tartrate; Treatment Outcome; Urinary Incontinence; Urination","Lee, Jeong Gu; Hong, Jae Yup; Choo, Myung-Soo; Kwon, Hun Young; Chung, Do Young; Lee, Kyu Sung; Lee, Ji Youl; Lee, Tack","This double-blind, multicenter study compared the efficacy and tolerability of tolterodine (Pharmacia, Los Angeles, USA) with that of oxybutynin (Alza, Palo Alto, USA) in Asian patients with overactive bladder.; Two-hundred-and-twenty-eight adults with overactive bladder symptoms were randomized to receive tolterodine 2 mg twice daily (bid) (n = 112) or oxybutynin 5 mg bid (n = 116). After 8 weeks' treatment, changes in micturition diary variables, patients' perception of treatment benefit, and tolerability endpoints were determined.; The mean (+/- SD) number of micturitions/24 h decreased by 2.6 +/- 2.9 (-21%) with tolterodine and 1.8 +/- 4.2 (-15%) with oxybutynin (both P = 0.0001 vs baseline). The mean number of incontinence episodes/24 h decreased by 2.2 +/- 2.3 (-85%) in the tolterodine group and by 1.4 +/- 1.8 (-58%) in the oxybutynin group (both P = 0.0001 vs baseline). Patient perception of treatment benefit was over 70% in each treatment group. Adverse events were significantly lower in the tolterodine group compared with oxybutynin-treated patients (55% vs 82%; P = 0.001). Dry mouth was reported by significantly fewer patients on tolterodine, compared with oxybutynin (35% vs 63%; P = 0.001) and withdrawals due to adverse events were lower in the tolterodine group than with those treated with oxybutynin (10% vs 16%). There were no safety concerns.; Tolterodine 2 mg bid is equally or more effective than oxybutynin 5 mg bid in the treatment of Asian patients with overactive bladder, and shows significantly better tolerability. This may enhance compliance during long-term treatment.",I,I
12074774,"Long-term safety, tolerability and efficacy of extended-release tolterodine in the treatment of overactive bladder.","Adult; Aged; Aged, 80 and over; Benzhydryl Compounds; Cresols; Delayed-Action Preparations; Double-Blind Method; Female; Humans; Male; Middle Aged; Muscarinic Antagonists; Phenylpropanolamine; Time Factors; Tolterodine Tartrate; Treatment Outcome; Urinary Bladder, Neurogenic","Kreder, K; Mayne, C; Jonas, U","The objective of the present study was to examine the long-term safety, tolerability and efficacy of tolterodine extended-release (ER) in patients who had completed 12 weeks' treatment in a randomised, double-blind study comparing tolterodine ER 4 mg once daily (qd), tolterodine immediate-release (IR) 2mg twice daily and placebo.; Of the 1377 patients completing the 12-week study, a total of 1077 (78%) chose to continue with 12 months' open-label treatment with tolterodine ER 4 mg once daily, irrespective of their previous treatment. Safety was assessed after 3, 6, 9 and 12 months' treatment in the study. Efficacy was evaluated from micturition diary variables and patients' perception of bladder condition and urgency following 3 and 12 months' treatment.; 71% of patients completed the 12-month study. Tolterodine ER was safe and well tolerated. Adverse events of the general (14.5%), autonomic (13.2%), gastrointestinal (11.4%), respiratory (9.8%) and urinary (9.1%) systems were the most frequently reported. Dry mouth was the most common event, occurring in 12.9% of patients, and was generally mild in severity. Other adverse events occurred in less than 5% of patients. There was no increase in the frequency of adverse events with long-term relative to short-term treatment. The efficacy of tolterodine was maintained over the 12-month treatment period; relative to baseline there were reductions in the number of incontinence episodes per week (median change -83%) and micturitions per 24 hours (median change -21%) and an increase in volume voided (median change +25%) after 12 months' treatment. An improvement in patient perception of their bladder condition was found in 75% of patients completing the study, and 51% had an improvement in patient perception of urgency.; Tolterodine ER 4mg qd displayed a favourable safety, tolerability and efficacy profile during 12 months' treatment of patients with overactive bladder.",I,I
12083983,Current pharmacotherapeutic strategies for overactive bladder.,Benzhydryl Compounds; Cholinergic Antagonists; Cresols; Delayed-Action Preparations; Humans; Mandelic Acids; Phenylpropanolamine; Quality of Life; Tolterodine Tartrate; Urinary Incontinence; Urination Disorders,"Garely, Alan D; Burrows, Lara J","Overactive bladder (OAB) is a chronic, distressing condition characterised by symptoms of urgency (sudden overwhelming urge to urinate) and frequency (urinating more than eight times daily), with or without urge urinary incontinence (sudden involuntary loss of urine). It affects millions of people of all ages and both sexes world wide, with greater prevalence in women and the elderly. The treatment of OAB is aimed at reducing debilitating symptoms, which have a significant effect on all aspects of an individual's quality of life, including social, domestic, psychological, occupational, physical and sexual functioning. Anticholinergic agents are currently recommended as first-line therapy for OAB. Their use results in significant clinical improvement in patients, although a lack of selectivity for receptors in the bladder may lead to troublesome side effects, including dry mouth, blurred vision, somnolence, dizziness and constipation. Recent research efforts have focused on developing drugs with a reduced propensity for causing these problems. Of the available anticholinergic agents, oxybutynin and tolterodine are the most widely used to treat OAB. Studies directly comparing tolterodine immediate-release (IR) with oxybutynin IR have shown that the two agents have similar efficacy. However, tolterodine IR is significantly better tolerated, particularly with respect to the incidence and severity of dry mouth. An extended-release formulation of tolterodine (4 mg capsules) has recently been developed to allow for once-daily dosing. In addition to greater convenience, tolterodine extended-release has shown enhanced efficacy and tolerability compared with tolterodine IR.",E,E
12110086,Risk of delirium with concomitant use of tolterodine and acetylcholinesterase inhibitors.,"Aged; Aged, 80 and over; Alzheimer Disease; Benzhydryl Compounds; Cholinesterase Inhibitors; Cresols; Delirium; Drug Interactions; Female; Humans; Male; Muscarinic Antagonists; Parkinson Disease; Phenylpropanolamine; Tolterodine Tartrate","Edwards, Keith R; O'Connor, Judy T",NA,E,E
12123469,The minor population of M3-receptors mediate contraction of human detrusor muscle in vitro.,"Aged; Female; Humans; In Vitro Techniques; Male; Middle Aged; Muscarinic Antagonists; Muscle Contraction; Muscle, Smooth; Piperidines; Receptor, Muscarinic M2; Receptor, Muscarinic M3; Receptors, Muscarinic; Urinary Bladder","Chess-Williams, R; Chapple, C R; Yamanishi, T; Yasuda, K; Sellers, D J","1 The objective was to determine the role of muscarinic receptor subtypes in mediating contraction of the human detrusor smooth muscle in vitro. 2 Contractile responses of human detrusor muscle strips to carbachol were obtained in the absence and presence of a range of muscarinic antagonists (pirenzepine, methoctramine, 4-diphenylacetoxy-N-methyl piperidine methiodide (4-DAMP), tropicamide, oxybutynin and tolterodine). Affinity estimates (pKB values) were calculated for the antagonists and correlated with values at the cloned muscarinic receptor subtypes quoted in the literature. 3 Pirenzepine, methoctramine and tropicamide drugs that have high affinities at M1, M2 and M4-receptors, respectively, all had low affinities on the human detrusor (pKB values of 6.8, 6.9 and 6.5, respectively), whilst the M3-selective antagonist 4-DAMP had a high affinity (9.5). Schild plots for all four antagonists had slopes of unity indicating an action at a single receptor. Oxybutynin and tolterodine also acted as competitive antagonists with affinity estimates of 7.6 and 8.1, respectively. 4 When the antagonist affinities obtained on the bladder were plotted against the values published for these antagonists at the cloned muscarinic receptor subtypes, the best correlations were obtained for the m3- and m5-muscarinic receptor subtypes. 5 These data suggest that direct contractile responses of the human detrusor muscle to muscarinic receptor stimulation in vitro are mediated solely via the M3-muscarinic receptor subtype with no contribution from the major M2-receptor population.",E,E
