pubmedID,title,keywords,authors,abstracts,label1,label2
11176403,Intravesical electromotive administration of oxybutynin in patients with detrusor hyperreflexia unresponsive to standard anticholinergic regimens.,"Administration, Intravesical; Adolescent; Adult; Autonomic Dysreflexia; Cholinergic Antagonists; Electricity; Female; Humans; Male; Mandelic Acids; Middle Aged; Urinary Bladder Diseases; Urodynamics","Di Stasi, S M; Giannantoni, A; Vespasiani, G; Navarra, P; Capelli, G; Massoud, R; Stephen, R L","About 15% to 20% of patients with detrusor hyperreflexia do not benefit from oral oxybutynin regimens, frequently because of unpleasant side effects. Several reports indicate that intravesical oxybutynin is effective in many of these patients but there are some who still fail to respond.; A select group of 10 adults with detrusor hyperreflexia unresponsive to standard oral and intravesical oxybutynin regimens were treated at weekly intervals with 5 mg. oxybutynin orally, or 5 mg. oxybutynin in 100 ml. intravesically for 60 minutes of passive diffusion and for 30 minutes with 5 mA. electrical current. Each treatment (plus oral placebo and 2 intravesical controls) was associated with an 8-hour, full urodynamic monitoring session, and periodic blood and bladder content sampling.; There was no significant objective improvement with oral or intravesical passive diffusion oxybutynin. Conversely there was significant improvement in 5 of 6 objective urodynamic measurements with intravesical electromotive oxybutynin. Plasma profiles were a single peak and decay following oral oxybutynin and 2 distinct peaks with intravesical passive diffusion and electromotive oxybutynin. Area under the curve for intravesical passive diffusion were 709 ng. per 8 hours versus oral 1,485 (p <0.05) versus intravesical electromotive 2,781 (p <0.001). Bladder content samples confirmed oxybutynin absorption. Oral oxybutynin caused anticholinergic side effects in 7 of 10 patients. There were no side effects with intravesical passive diffusion or electromotive administrations.; Accelerated intravesical administration results in greater bioavailability and increased objective benefits without side effects in previously unresponsive patients compared with oral and intravesical passive diffusion oxybutynin administration.",E,E
11176516,Use of tolterodine in children with dysfunctional voiding: an initial report.,"Adolescent; Benzhydryl Compounds; Child; Child, Preschool; Cresols; Female; Humans; Male; Muscarinic Antagonists; Phenylpropanolamine; Retrospective Studies; Tolterodine Tartrate; Urinary Incontinence","Munding, M; Wessells, H; Thornberry, B; Riden, D","Tolterodine was recently approved for the treatment of incontinence and overactive bladder in adults, and has fewer side effects than oxybutynin. We evaluated the safety and efficacy of tolterodine in children with dysfunctional voiding.; We retrospectively reviewed our experience with 30 pediatric patients treated with tolterodine for a primary diagnosis of dysfunctional voiding. Patients were treated with adult doses of tolterodine and behavioral modifications. Standard definitions determined by the International Children's Continence Society were adapted to designate final treatment outcomes on medication as cured-greater than 90% reduction in wetting episodes, improved-greater than 50% reduction or failed-less than 50% reduction.; The children were 4 to 17 years old (mean age 8.7) and were treated with tolterodine for an average of 5.2 months. The final dose was 1 mg. twice daily in 1, 2 mg. twice daily in 27 and 4 mg. twice daily in 2 patients. Wetting episodes were cured in 10 (33%), improved in 12 (40%), and failed to show improvement in 8 (27%) cases. Four patients (13.3%) reported side effects and only 1 discontinued the medication due to diarrhea. There were no reports of hyperpyrexia, flushing or intolerance to sunshine and outdoor temperature.; Our results demonstrate that tolterodine at adult doses without titration can be used safely to decrease wetting episodes in children with dysfunctional voiding. Controlled clinical trials should be completed to evaluate further efficacy and safety in children.",E,E
11207885,Association between oxybutynin and neuropsychiatric adverse effects not confirmed in daily practice.,"Aged; Aged, 80 and over; Antipsychotic Agents; Cholinergic Antagonists; Drug Prescriptions; Drug Utilization; Flavoxate; Humans; Mandelic Acids; Mental Disorders; Middle Aged; Nervous System Diseases; Netherlands; Parasympatholytics; Pharmacies; Retrospective Studies; Risk Factors; Urination Disorders","Movig, K L; Egberts, A C; Lenderink, A W; Leufkens, H G",NA,I,I
11210400,Lack of effect of food on the pharmacokinetics of an extended-release oxybutynin formulation.,"Adolescent; Adult; Chemistry, Pharmaceutical; Cholinergic Antagonists; Cross-Over Studies; Delayed-Action Preparations; Female; Food; Food-Drug Interactions; Humans; Male; Mandelic Acids","Sathyan, G; Hu, W; Gupta, S K","The effect of food on the pharmacokinetics of 15 mg oxybutynin XL was evaluated in a single-dose, randomized, crossover, open-label study in healthy volunteers. A validated, stereospecific, high-performance liquid chromatography assay was used to simultaneously determine the plasma concentrations of R- and S-oxybutynin and active metabolite R- and S-desethyloxybutynin. The mean AUC and Cmax values for each of the four analytes in the fed treatment were within +/- 20% of the fasting treatment values. The 90% confidence intervals for the treatment ratios (fed/fasted) for log-transformed Cmax and AUCinf values for the drug isomers and AUCinf values for the metabolite isomers were all within the 80% to 125% range. Only the ranges for the Cmax values for R- and S-desethyloxybutynin were slightly wider but were well within the 70% to 143% criteria recommended for Cmax when comparing effect of food. Lack of effect of food on oxybutynin XL is consistent with the previous observation that the osmotically controlled formulations are nearly insensitive to the gastrointestinal environment, including food. Oxybutynin XL was well tolerated, and the safety results were comparable whether administered alone or with food. In conclusion, oxybutynin XL administration does not require any caution to be exercised regarding food.",I,8
11248608,Tolterodine once-daily: superior efficacy and tolerability in the treatment of the overactive bladder.,"Administration, Oral; Adult; Benzhydryl Compounds; Cresols; Double-Blind Method; Drug Administration Schedule; Female; Humans; Male; Muscarinic Antagonists; Phenylpropanolamine; Tolterodine Tartrate; Urinary Bladder Diseases; Urinary Incontinence; Urination Disorders","Van Kerrebroeck, P; Kreder, K; Jonas, U; Zinner, N; Wein, A","To evaluate the efficacy and tolerability of a new extended-release (ER), once-daily, capsule formulation of tolterodine, relative to placebo and the existing immediate-release (IR), twice-daily, tablet formulation, for treatment of the overactive bladder.; This was a double-blind, multicenter, randomized, placebo-controlled trial. One thousand five hundred twenty-nine patients (81% women) with urinary frequency (eight or more micturitions every 24 hours) and urge incontinence (five or more episodes per week) were randomized to oral therapy with tolterodine ER 4 mg once daily (n = 507), tolterodine IR 2 mg twice daily (n = 514), or placebo (n = 508) for 12 weeks. Efficacy was assessed at the end of the treatment period on the basis of the micturition diary variables. Tolerability and safety were assessed by evaluating the adverse events, electrocardiogram parameters, laboratory values, and treatment withdrawals.; Tolterodine ER 4 mg once daily (P = 0.0001) and tolterodine IR 2 mg twice daily (P = 0.0005) both significantly reduced the mean number of urge incontinence episodes per week compared with placebo. The median reduction in these episodes as a percentage of the baseline values was 71% for tolterodine ER, 60% for tolterodine IR, and 33% for placebo. The ER formulation was 18% more effective than the IR formulation (P <0.05). Treatment with both formulations of tolterodine was also associated with statistically significant improvements in all other micturition diary variables compared with placebo. For both formulations, the mean decreases in micturition frequency (P <0.0079) and pad usage (P <0.0145) were significant, and the mean volume voided per micturition increased (P = 0.0001). The rate of dry mouth (of any severity) was 23% for tolterodine ER, 30% for tolterodine IR, and 8% for placebo. The overall dry mouth rate for patients taking tolterodine ER was 23% lower than for tolterodine IR (P <0.02), and the rate of severe dry mouth in the ER group was only 1.8%. The rates of withdrawal were comparable for the two active groups and the placebo group. No safety concerns were noted.; Tolterodine ER 4 mg once daily is effective and well tolerated in the treatment of overactive bladder with no safety concerns. Tolterodine ER demonstrated an improved efficacy for reducing urge incontinence episodes and a lower frequency of dry mouth compared with the existing IR twice-daily formulation.",I,I
11269570,Food increases the bioavailability of tolterodine but not effective exposure.,"Adult; Analysis of Variance; Area Under Curve; Benzhydryl Compounds; Biological Availability; Cresols; Cross-Over Studies; Cytochrome P-450 CYP2D6; Eating; Fasting; Female; Half-Life; Humans; Male; Middle Aged; Models, Theoretical; Muscarinic Antagonists; Phenylpropanolamine; Tolterodine Tartrate","Olsson, B; Brynne, N; Johansson, C; Arnberg, H","The objective of this study was to investigate the influence of food on the pharmacokinetics of tolterodine, its active 5-hydroxymethyl metabolite (5-HM), and exposure to the active moiety (sum of unbound tolterodine + 5-HM) in healthy volunteers. Serum concentrations of tolterodine and 5-HM were measured for up to 12 hours after a single oral dose (2 mg) of tolterodine L-tartrate, administered either on an empty stomach or with a standardized medium-fat breakfast. All 23 subjects completing the study were classified as extensive metabolizers (phenotyped with debrisoquine). Pharmacokinetic data on tolterodine and the active moiety were evaluable for 22 subjects; all completing subjects were evaluable for 5-HM pharmacokinetics. Based on Cmax and AUC(infinity) ratios, relative bioavailability of tolterodine in the presence of food was 1.49 (90% confidence interval [CI], 1.35-1.71) and 1.53 (1.35-1.72), respectively. The pharmacokinetics of 5-HM and the active moiety were unaffected by food, as were the rates of drug absorption and terminal half-lives of tolterodine and 5-HM. Given that bioequivalence was observed for the active moiety underfed and fasting conditions, the authors concluded that coadministration of tolterodine with food is not expected to have any clinically relevant effects.",I,8
11286323,Food does not influence the pharmacokinetics of a new extended release formulation of tolterodine for once daily treatment of patients with overactive bladder.,Adult; Benzhydryl Compounds; Biological Availability; Cresols; Cross-Over Studies; Delayed-Action Preparations; Female; Food-Drug Interactions; Humans; Male; Middle Aged; Phenylpropanolamine; Tolterodine Tartrate; Urinary Bladder Diseases,"Olsson, B; Szamosi, J","To determine whether food intake influences the pharmacokinetics of a new, once daily, extended release (ER) capsule formulation of tolterodine in healthy volunteers, and to compare its bioavailability with that of the existing immediate release (IR) tablet.; Open, randomised, 3-way crossover trial.; 17 healthy volunteers (3 females, 14 males) aged between 19 and 50 years. With the exception of 1 male volunteer, all participants were classified as extensive metabolisers by cytochrome P450 2D6 genotyping.; Volunteers received single oral doses of tolterodine L-tartrate ER 8 mg (2 x 4 mg capsules) on an empty stomach or with a standardised high-fat breakfast. Reference therapy comprised tolterodine L-tartrate IR 4 mg (2 x 2 mg tablets), administered in the fasting state. Serum concentrations of tolterodine, its active 5-hydroxymethyl metabolite (5-HM) and the active moiety (sum of unbound tolterodine + 5-HM) were measured for up to 72 hours post-dose. Safety endpoints were also determined.; No effect of food on the bioavailability of tolterodine ER capsules was apparent and there was no sign of dose-dumping with meals. The geometric mean fed:fasting ratio of area under the serum concentration-time curve to infinity (AUCinfinity) of the active moiety, for all volunteers combined, was 0.95 (90% confidence interval 0.88 to 1.03). Equivalence with respect to AUCinfinity (dose-corrected) was also found for the ER capsule compared with the IR tablet, although uncorrected maximum serum concentrations were around 50% lower despite the fact that the capsule dose was twice as high. Seven volunteers reported adverse events, predominantly headache. No volunteer reported dry mouth. Overall, there were no safety concerns.; The new ER formulation of tolterodine shows no pharmacokinetic interaction with food. On the basis of these results, patients with overactive bladder may, therefore, be advised to take the drug without regard to the timing of meals, maximising convenience during therapy.",I,8
11294516,Oxybutynin does not affect cyclosporin blood levels.,"Child; Child, Preschool; Cholinergic Antagonists; Cyclosporine; Drug Interactions; Female; Humans; Immunosuppressive Agents; Male; Mandelic Acids","Springate, J E","Cyclosporin is an important immunosuppressive medication used to prevent organ rejection. Drug interactions that alter its blood levels can cause serious problems with toxicity or transplant rejection. Current evidence indicates that both cyclosporin and oxybutynin, which is used to treat bladder dysfunction, are metabolized by the cytochrome P450 3A enzyme system, raising the possibility of an adverse interaction between these medications. However, a study of two children receiving cyclosporin with and without oxybutynin revealed no significant changes in trough blood cyclosporin concentrations.",I,8
11298060,The overactive bladder in children: a potential future indication for tolterodine.,"Administration, Oral; Benzhydryl Compounds; Child; Child, Preschool; Cresols; Dose-Response Relationship, Drug; Female; Humans; Male; Muscarinic Antagonists; Phenylpropanolamine; Tolterodine Tartrate; Urinary Incontinence","Hj盲lm氓s, K; Hellstr枚m, A L; Mogren, K; L盲ckgren, G; Stenberg, A","To determine the safety, efficacy and pharmacokinetics of tolterodine in children with an overactive bladder.; Thirty-three children (20 boys and 13 girls, aged 5-10 years) with an overactive bladder and symptoms of urgency, frequency and/or urge incontinence were enrolled in an open, dose-escalation study. Patients were treated with oral tolterodine 0.5 mg (n = 11), 1 mg (n = 10) or 2 mg (n = 12) twice daily for 14 days. The primary safety endpoint was the change in residual urinary volume, as determined by ultrasonography. In addition, voiding diary variables (frequency and incontinence episodes) and pharmacokinetics were evaluated. Other safety endpoints included laboratory variables, electrocardiogram recordings and reported adverse events.; There were no safety concerns in terms of the change in residual urinary volume for any of the three dosage groups; values were comparable with baseline after 2 weeks of treatment for all three dosages. Adverse events were reported by 20 patients (six on 0.5 mg, five on 1 mg, and nine on 2 mg). Most adverse events were not considered to be drug-related; of the 13 possibly related events, 10 occurred in those taking 2 mg. Headache was the most commonly reported adverse event. No serious adverse events were reported and there were no general safety concerns. There was an improvement in voiding diary variables in all treatment groups after 2 weeks of treatment, although the efficacy was greatest in those taking 1 mg and 2 mg. Pharmacokinetic findings were consistent with dose linearity over the range 0.5-2 mg.; The results support the use of 1 mg twice daily as the optimal dose of tolterodine for treating children aged 5-10 years with an overactive bladder.",E,E
11302288,Economics of lower urinary tract symptoms (LUTS) in older people.,Aged; Cost of Illness; Estrogen Replacement Therapy; Female; Health Care Costs; Humans; Male; Quality of Life; Urinary Bladder Diseases; Urinary Incontinence; Urinary Tract Infections; Urinary Tract Physiological Phenomena; Urination Disorders,"Azam, U; Castleden, M; Turner, D",Urinary incontinence is an area of clinical and social importance to older people and providers of care. This article provides an update on the 'symptom' of urinary incontinence and reviews the concept of lower urinary tract symptoms (LUTS). The challenges facing health services researchers working in this field are also discussed in terms of trying to quantify the size and extent of the underlying problem. Economic issues and work undertaken to evaluate the cost of LUTS are appraised and the common nonsurgical treatments for LUTS are described together with associated conditions and their cost implications. The cost to individuals and society of LUTS is generally underestimated and the importance of reducing its severity (if cure is not achievable) makes clinical and economic sense.,E,E
11322348,Medical management of overactive bladder.,"Age Distribution; Aged; Cholinergic Antagonists; Female; Humans; Incidence; Male; Middle Aged; Prognosis; Risk Factors; Urinary Bladder, Neurogenic; Urinary Incontinence, Stress; Urination Disorders","Elliott, D S; Lightner, D J; Blute, M L",NA,E,E
11322350,Prospective randomized controlled trial of extended-release oxybutynin chloride and tolterodine tartrate in the treatment of overactive bladder: results of the OBJECT Study.,"Aged; Benzhydryl Compounds; Cresols; Delayed-Action Preparations; Double-Blind Method; Drug Administration Schedule; Female; Follow-Up Studies; Humans; Male; Mandelic Acids; Middle Aged; Muscarinic Antagonists; Nervous System Diseases; Phenylpropanolamine; Probability; Prospective Studies; Reference Values; Severity of Illness Index; Statistics, Nonparametric; Tartrates; Tolterodine Tartrate; Treatment Outcome; Urinary Bladder, Neurogenic; Urinary Incontinence, Stress; Urination Disorders; Xerostomia","Appell, R A; Sand, P; Dmochowski, R; Anderson, R; Zinner, N; Lama, D; Roach, M; Miklos, J; Saltzstein, D; Boone, T; Staskin, D R; Albrecht, D","To compare the efficacy and tolerability of extended-release oxybutynin chloride and tolterodine tartrate at 12 weeks in participants with overactive bladder.; The OBJECT (Overactive Bladder: Judging Effective Control and Treatment) study was a prospective, randomized, double-blind, parallel-group study conducted between March and October 2000 at 37 US study sites. Participants who had between 7 and 50 episodes of urge incontinence per week and 10 or more voids in 24 hours received extended-release oxybutynin, 10 mg/d, or tolterodine, 2 mg twice daily. The outcome measures were the number of episodes of urge incontinence, total incontinence, and micturition frequency at 12 weeks adjusted for baseline.; A total of 315 women and 63 men were randomized and treated, and 332 participants (276 women, 56 men) completed the study. At the end of the study, extended-release oxybutynin was significantly more effective than tolterodine in each of the main outcome measures: weekly urge incontinence (P=.03), total incontinence (P=.02), and micturition frequency episodes (P=.02) adjusted for baseline. Both drugs improved symptoms of overactive bladder significantly from baseline to the end of the study as assessed by the 3 main outcome measures (P<.001). Dry mouth, the most common adverse event, was reported by 28.1% and 33.2% of participants taking extended-release oxybutynin and tolterodine, respectively (P=.32). Rates of central nervous system and other adverse events were low and similar in both groups.; Extended-release oxybutynin was more effective than tolterodine as measured by end-of-study urge incontinence, total incontinence, and micturition frequency episodes. Both groups had similar rates of dry mouth and other adverse events.",I,I
11327200,Multiple dose pharmacokinetics of a new once daily extended release tolterodine formulation versus immediate release tolterodine.,Adolescent; Adult; Area Under Curve; Benzhydryl Compounds; Cresols; Cross-Over Studies; Cytochrome P-450 CYP2D6; Delayed-Action Preparations; Female; Humans; Male; Middle Aged; Muscarinic Antagonists; Phenylpropanolamine; Tolterodine Tartrate,"Olsson, B; Szamosi, J","To determine the multiple dose pharmacokinetics of a new extended release (ER) capsule formulation of tolterodine, compared with the existing immediate release (IR) tablet, in healthy volunteers.; Nonblind, randomised, 2-way crossover trial.; 19 healthy volunteers (7 females, 12 males), mean age 33 years (range 18 to 55 years). Prior to the study, all volunteers were classified as either extensive or poor metabolisers by cytochrome P450 2D6 genotyping.; Volunteers received tolterodine ER 4mg once daily or tolterodine IR 2mg twice daily for 6 days (all doses given as the L-tartrate salt). A washout period of 7 days separated the 2 treatments. Serum concentrations of tolterodine, its active 5-hydroxymethyl metabolite (5-HM) and the active moiety (extensive metabolisers: sum of unbound tolterodine + 5-HM; poor metabolisers: unbound tolterodine) were measured for up to 48 hours post-dose on day 6 (steady state). Tolerability was also determined.; 17 volunteers (13 extensive metabolisers, 4 poor metabolisers) completed the study and were evaluable for both treatment periods. The 90% confidence interval for the geometric mean ratio of area under the serum concentration-time curve to 24 hours (AUC24) of the active moiety, for all volunteers combined, indicated equivalence for the 2 formulations. Pooled analysis also demonstrated that the peak serum concentration (Cmax) of the active moiety following administration of tolterodine ER was around 75% of that observed for the IR tablet, whereas the trough concentration was around 1.5-fold higher. Overall, the pharmacokinetics of tolterodine (irrespective of genotype) and 5-HM (extensive metabolisers only) were consistent with sustained drug release over 24 hours. Tolterodine ER was well tolerated.; The new once daily ER formulation of tolterodine 4mg shows pharmacokinetic equivalence (AUC24) to the existing IR tablet given at a dose of 2mg twice daily. Findings of lower Cmax for tolterodine ER may explain the significantly lower rate of dry mouth subsequently observed in patients with overactive bladder.",I,8
11341475,Tolterodine: a review of its use in the treatment of overactive bladder.,"Benzhydryl Compounds; Clinical Trials as Topic; Cresols; Humans; Muscarinic Antagonists; Phenylpropanolamine; Receptors, Muscarinic; Tolterodine Tartrate; Urination Disorders","Clemett, D; Jarvis, B","Tolterodine is a competitive muscarinic receptor antagonist that shows in vivo selectivity for the bladder over the salivary glands compared with oxybutinin. Results of randomised double-blind placebo-controlled studies indicate that tolterodine 4 mg/day (administered as immediate-release tablets 2mg twice daily or extended-release capsules 4mg daily) is superior to placebo in improving micturition diary variables in patients with overactive bladder. Moreover, tolterodine 2mg twice daily is as effective as oxybutynin 5mg 3 times daily. Maximum treatment effects with both drugs occurred after 5 to 8 weeks of treatment and improvements were maintained during long term treatment for up to 24 months. In a pooled analysis of four 12-week studies, equivalent and significant reductions in micturition frequency (-2.3 and -2.0 vs -1.4, p < 0.001) and the incidence of urge incontinence episodes (-1.6 and -1.8 vs -1.1, p < 0.05) were reported for tolterodine 2mg twice daily and oxybutynin 5mg 3 times daily compared with placebo. Functional bladder capacity was also significantly increased. Improvements in patient perceptions of their urgency symptoms and of problems caused by their bladder condition were significantly greater during treatment with tolterodine than with placebo. Tolterodine was generally well tolerated in clinical trials of up to 24 months' duration. Dry mouth was the most frequent adverse event. The incidence (40 vs 78%, p < 0.001) and intensity of this event was lower with tolterodine 2mg twice daily than oxybutynin 5mg 3 times daily. Additionally, a 23% lower incidence of dry mouth was reported with once daily extended-release tolterodine capsules than with twice daily immediate-release tablets (p < 0.02). The incidence of adverse CNS events with tolterodine was low and similar to that of placebo. Tolterodine was well tolerated in elderly patients and no serious tolerability concerns were identified.; Tolterodine is the first antimuscarinic agent to specifically developed for the treatment of overactive bladder. The functional selectivity of tolterodine for the bladder translates into good efficacy and tolerability in patients, including the elderly, with overactive bladder. Tolterodine is as effective as oxybutynin in improving micturition diary variables but is associated with a significantly lower incidence and intensity of dry mouth. This favourable tolerability profile, together with sustained clinical efficacy during long term treatment, places tolterodine as valuable treatment for the symptoms of overactive bladder.",E,E
